{
  "schema": "madb.package-request/1",
  "selector": {
    "route": "RUST-C-ABI",
    "profile_id": "rust-c-fixture",
    "profile_digest": "sha256:70dde7881610c582d49ef26a53cf3e82929622adcf112eb1ab79cc70dd65cfb8",
    "target": "aarch64-apple-darwin",
    "direction": "consumer-to-provider"
  },
  "output_set": {
    "path": "outputs.json",
    "sha256": "sha256:f16d05ec6b29248d2c61adb1e9263f78e4f7bace1b955014a2d17872cfe4064d",
    "size": 7,
    "schema": "madb.output-set/1"
  },
  "build_evidence": [
    {
      "path": "evidence/build.json",
      "sha256": "sha256:f16d05ec6b29248d2c61adb1e9263f78e4f7bace1b955014a2d17872cfe4064d",
      "size": 7,
      "schema": "madb.build-evidence/1"
    }
  ],
  "lock": {
    "path": "madb.lock",
    "sha256": "sha256:f16d05ec6b29248d2c61adb1e9263f78e4f7bace1b955014a2d17872cfe4064d",
    "size": 7,
    "schema": "madb.lock/1"
  },
  "contract_digest": "sha256:467501ee75d0be2236f4f9986fb08ce4a8fb1b2c15e454ea62dd8914fe513f71",
  "policy_digest": "sha256:0718f74ee75a9182bf6a08c170b97313654d5c078971d17093b164a436ab9932",
  "generation_id": "sha256:1b70ad72ef6218f68ce034a05b2347233856f3ae391b61e40e85073b79e4a772",
  "dependencies": [],
  "public_symbols": [
    "fixture.await_closed.v1",
    "fixture.checksum.v1",
    "fixture.create.v1",
    "fixture.release_handle.v1",
    "fixture.request_close.v1"
  ],
  "required_cases": [
    "DATA-001/positive/rust-c"
  ],
  "output_root": "staging/package"
}
